"Display Order","Product Details","ASIN","URL","Image URL","Brand","Price  £","Parent Level Sales","ASIN Sales","Recent Purchases","Parent Level Revenue","ASIN Revenue","Title Char. Count","BSR","Seller Country/Region","Fees  £","Active Sellers","Ratings","Review Count","Images","Review velocity","Buy Box","Category","Size Tier","Fulfillment","Dimensions","Weight","ABA Most Clicked","Creation Date","Sponsored","Best Seller","Seller Age (mo)","Seller"
84.,"Fruit Fly Traps Trap Indoor Sticky Yellow For Home Use Protect Plants Plant Houseplant Fungus Gnat Killer Insect Catcher Bug Catchers Control Pests Whitefly Non Toxic Odourless Safe Waterproof (10)","B0D6C2KGNB","https://www.amazon.co.uk/dp/B0D6C2KGNB?psc=1","https://m.media-amazon.com/images/I/61fvILG++aL._AC_SY355_.jpg","Evanmore",3.93,106,66,"N/A",493.94,223.03,197,"12,363","GB",2,1,4.3,109,9,1,"Evanmore Ltd","Garden","Standard Envelope","FBA","15.20 x 1.30 x 10.10 cm",0.04,"N/A","Jun 21, 2024",,"No",21,"Evanmore Ltd"
105.,"VEYOFLY Fruit Fly Trap Indoor (1 Device + 3 Refills), Gnat Catcher, Plug-In Light Insect Trap for House, Bug Killer","B0BJ1FLRJ5","https://www.amazon.co.uk/dp/B0BJ1FLRJ5?psc=1","https://m.media-amazon.com/images/I/61TCxMkmLBL._AC_SX355_.jpg","VEYOFLY",23.15,118,68,50,"2,806.45","1,358.49",115,"8,314","US",6.88,1,3.7,"3,202",9,44,"VEYOFLY UK","Garden","Small Parcel","FBA","22.50 x 8.90 x 10.80 cm",0.31,"N/A","Jan 30, 2023",,"No",38,"VEYOFLY UK"
"105.1.","VEYOFLY Fruit Fly Traps for Indoors Refill, Gnat Traps For House Indoors, Fly Catcher Indoor, Fly Traps Indoor, Fly Trap, Plug in Catch for Fruit Flies, Moths, Gnats, Mosquito (Pack of 10 Refills)","B0BN628DCL","https://www.amazon.co.uk/dp/B0BN628DCL?psc=1","https://m.media-amazon.com/images/I/81NHQpyYFGL._AC_SY355_.jpg","VEYOFLY",23.15,118,10,"N/A","2,806.45",197.87,196,"8,314","N/A",4.88,1,3.7,"3,202",8,48,"VEYOFLY UK","Garden","Standard Envelope","FBA","15.30 x 1.40 x 7.10 cm",0.05,"N/A","Feb 7, 2023",,"No",37,"VEYOFLY UK"
"105.2.","VEYOFLY Fruit Fly Traps for Indoors Refill, Gnat Traps For House Indoor, Fly Catcher Indoor, Fly Traps Indoors, Fly Trap, Plug in Catch for Fruit Flies, Moths, Gnats, Mosquito(Pack of 15 Refills)","B0BN5PRQ9S","https://www.amazon.co.uk/dp/B0BN5PRQ9S?psc=1","https://m.media-amazon.com/images/I/815nxoFCgmL._AC_SY355_.jpg","VEYOFLY",28.95,118,19,"N/A","2,806.45",465.24,195,"8,314","N/A",5.82,1,3.7,"3,202",8,48,"VEYOFLY UK","Garden","Standard Envelope","FBA","15.40 x 1.70 x 7.00 cm",0.08,"N/A","Feb 18, 2023",,"No",37,"VEYOFLY UK"
"105.3.","VEYOFLY Fruit Fly Traps for Indoor Use, Indoor Fly Traps, 4 Devices and 12 Refills, Insect Traps","B0D7F32R2H","https://www.amazon.co.uk/dp/B0D7F32R2H?psc=1","https://m.media-amazon.com/images/I/810OsNwImvL._AC_SY355_.jpg","VEYOFLY",63.49,118,2,"N/A","2,806.45",116.43,96,"8,312","N/A",11.47,1,3.7,"3,202",9,48,"Amazon US","Garden","Standard Parcel","MFN","23.01 x 15.80 x 18.49 cm",1.03,"N/A","Dec 19, 2024",,"No",15,"Amazon US"
"105.4.","VEYOFLY Indoor Flying Insect Trap - Plug-in Fruit Fly, Gnat and Mosquito Trap With Refills - Odorless Bug Light for Home(2 Device + 4 Glue Boards)","B0BKX931FF","https://www.amazon.co.uk/dp/B0BKX931FF?psc=1","https://m.media-amazon.com/images/I/61yy0Yl5NnL._AC_SX355_.jpg","VEYOFLY",42.86,118,18,"N/A","2,806.45",653.82,146,"8,312","N/A",8.52,1,3.7,"3,202",9,48,"VEYOFLY UK","Garden","Small Parcel","FBA","22.50 x 9.20 x 16.80 cm",0.56,"N/A","Mar 20, 2023",,"No",36,"VEYOFLY UK"